{
  "description": "JSONSchemaProps is a JSON-Schema following Specification Draft 4 (http://json-schema.org/).",
  "properties": {
    "$ref": {
      "type": [
        "string",
        "null"
      ]
    },
    "$schema": {
      "type": [
        "string",
        "null"
      ]
    },
    "additionalItems": {
      "$ref": "_definitions.json#/definitions/io.k8s.apiextensions-apiserver.pkg.apis.apiextensions.v1beta1.JSONSchemaPropsOrBool"
    },
    "additionalProperties": {
      "$ref": "_definitions.json#/definitions/io.k8s.apiextensions-apiserver.pkg.apis.apiextensions.v1beta1.JSONSchemaPropsOrBool"
    },
    "allOf": {
      "items": {
        "$ref": "_definitions.json#/definitions/io.k8s.apiextensions-apiserver.pkg.apis.apiextensions.v1beta1.JSONSchemaProps"
      },
      "type": [
        "array",
        "null"
      ]
    },
    "anyOf": {
      "items": {
        "$ref": "_definitions.json#/definitions/io.k8s.apiextensions-apiserver.pkg.apis.apiextensions.v1beta1.JSONSchemaProps"
      },
      "type": [
        "array",
        "null"
      ]
    },
    "default": {
      "$ref": "_definitions.json#/definitions/io.k8s.apiextensions-apiserver.pkg.apis.apiextensions.v1beta1.JSON"
    },
    "definitions": {
      "additionalProperties": {
        "$ref": "_definitions.json#/definitions/io.k8s.apiextensions-apiserver.pkg.apis.apiextensions.v1beta1.JSONSchemaProps"
      },
      "type": "object"
    },
    "dependencies": {
      "additionalProperties": {
        "$ref": "_definitions.json#/definitions/io.k8s.apiextensions-apiserver.pkg.apis.apiextensions.v1beta1.JSONSchemaPropsOrStringArray"
      },
      "type": "object"
    },
    "description": {
      "type": [
        "string",
        "null"
      ]
    },
    "enum": {
      "items": {
        "$ref": "_definitions.json#/definitions/io.k8s.apiextensions-apiserver.pkg.apis.apiextensions.v1beta1.JSON"
      },
      "type": [
        "array",
        "null"
      ]
    },
    "example": {
      "$ref": "_definitions.json#/definitions/io.k8s.apiextensions-apiserver.pkg.apis.apiextensions.v1beta1.JSON"
    },
    "exclusiveMaximum": {
      "type": "boolean"
    },
    "exclusiveMinimum": {
      "type": "boolean"
    },
    "externalDocs": {
      "$ref": "_definitions.json#/definitions/io.k8s.apiextensions-apiserver.pkg.apis.apiextensions.v1beta1.ExternalDocumentation"
    },
    "format": {
      "type": [
        "string",
        "null"
      ]
    },
    "id": {
      "type": [
        "string",
        "null"
      ]
    },
    "items": {
      "$ref": "_definitions.json#/definitions/io.k8s.apiextensions-apiserver.pkg.apis.apiextensions.v1beta1.JSONSchemaPropsOrArray"
    },
    "maxItems": {
      "format": "int64",
      "type": "integer"
    },
    "maxLength": {
      "format": "int64",
      "type": "integer"
    },
    "maxProperties": {
      "format": "int64",
      "type": "integer"
    },
    "maximum": {
      "format": "double",
      "type": "number"
    },
    "minItems": {
      "format": "int64",
      "type": "integer"
    },
    "minLength": {
      "format": "int64",
      "type": "integer"
    },
    "minProperties": {
      "format": "int64",
      "type": "integer"
    },
    "minimum": {
      "format": "double",
      "type": "number"
    },
    "multipleOf": {
      "format": "double",
      "type": "number"
    },
    "not": {
      "$ref": "_definitions.json#/definitions/io.k8s.apiextensions-apiserver.pkg.apis.apiextensions.v1beta1.JSONSchemaProps"
    },
    "nullable": {
      "type": "boolean"
    },
    "oneOf": {
      "items": {
        "$ref": "_definitions.json#/definitions/io.k8s.apiextensions-apiserver.pkg.apis.apiextensions.v1beta1.JSONSchemaProps"
      },
      "type": [
        "array",
        "null"
      ]
    },
    "pattern": {
      "type": [
        "string",
        "null"
      ]
    },
    "patternProperties": {
      "additionalProperties": {
        "$ref": "_definitions.json#/definitions/io.k8s.apiextensions-apiserver.pkg.apis.apiextensions.v1beta1.JSONSchemaProps"
      },
      "type": "object"
    },
    "properties": {
      "additionalProperties": {
        "$ref": "_definitions.json#/definitions/io.k8s.apiextensions-apiserver.pkg.apis.apiextensions.v1beta1.JSONSchemaProps"
      },
      "type": "object"
    },
    "required": {
      "items": {
        "type": "string"
      },
      "type": [
        "array",
        "null"
      ]
    },
    "title": {
      "type": [
        "string",
        "null"
      ]
    },
    "type": {
      "type": [
        "string",
        "null"
      ]
    },
    "uniqueItems": {
      "type": "boolean"
    }
  },
  "type": "object",
  "$schema": "http://json-schema.org/schema#"
}